{
  "schema_version": "1.0",
  "map_type": "tokens",
  "status": "implemented",
  "collection": "Vineyard Foundations",
  "source_paths": [
    "design-system/tokens/vineyard.tokens.json",
    "design-system/tokens/vineyard.css"
  ],
  "source_digest": "a33fdcf14c44d38f6ac0435f27f3b15ab2baeb048b34d1536f8e57ba360a247b",
  "tokens": [
    {
      "token_path": "ref.color.ink.300",
      "figma_variable": "ref/color/ink/300",
      "collection": "Vineyard Foundations",
      "type": "color"
    },
    {
      "token_path": "ref.color.ink.500",
      "figma_variable": "ref/color/ink/500",
      "collection": "Vineyard Foundations",
      "type": "color"
    },
    {
      "token_path": "ref.color.ink.650",
      "figma_variable": "ref/color/ink/650",
      "collection": "Vineyard Foundations",
      "type": "color"
    },
    {
      "token_path": "ref.color.ink.800",
      "figma_variable": "ref/color/ink/800",
      "collection": "Vineyard Foundations",
      "type": "color"
    },
    {
      "token_path": "ref.color.ink.950",
      "figma_variable": "ref/color/ink/950",
      "collection": "Vineyard Foundations",
      "type": "color"
    },
    {
      "token_path": "ref.color.mineral.0",
      "figma_variable": "ref/color/mineral/0",
      "collection": "Vineyard Foundations",
      "type": "color"
    },
    {
      "token_path": "ref.color.mineral.50",
      "figma_variable": "ref/color/mineral/50",
      "collection": "Vineyard Foundations",
      "type": "color"
    },
    {
      "token_path": "ref.color.mineral.100",
      "figma_variable": "ref/color/mineral/100",
      "collection": "Vineyard Foundations",
      "type": "color"
    },
    {
      "token_path": "ref.color.mineral.200",
      "figma_variable": "ref/color/mineral/200",
      "collection": "Vineyard Foundations",
      "type": "color"
    },
    {
      "token_path": "ref.color.mineral.300",
      "figma_variable": "ref/color/mineral/300",
      "collection": "Vineyard Foundations",
      "type": "color"
    },
    {
      "token_path": "ref.color.vine.100",
      "figma_variable": "ref/color/vine/100",
      "collection": "Vineyard Foundations",
      "type": "color"
    },
    {
      "token_path": "ref.color.vine.300",
      "figma_variable": "ref/color/vine/300",
      "collection": "Vineyard Foundations",
      "type": "color"
    },
    {
      "token_path": "ref.color.vine.500",
      "figma_variable": "ref/color/vine/500",
      "collection": "Vineyard Foundations",
      "type": "color"
    },
    {
      "token_path": "ref.color.vine.700",
      "figma_variable": "ref/color/vine/700",
      "collection": "Vineyard Foundations",
      "type": "color"
    },
    {
      "token_path": "ref.color.vine.900",
      "figma_variable": "ref/color/vine/900",
      "collection": "Vineyard Foundations",
      "type": "color"
    },
    {
      "token_path": "ref.color.clay.100",
      "figma_variable": "ref/color/clay/100",
      "collection": "Vineyard Foundations",
      "type": "color"
    },
    {
      "token_path": "ref.color.clay.500",
      "figma_variable": "ref/color/clay/500",
      "collection": "Vineyard Foundations",
      "type": "color"
    },
    {
      "token_path": "ref.color.clay.700",
      "figma_variable": "ref/color/clay/700",
      "collection": "Vineyard Foundations",
      "type": "color"
    },
    {
      "token_path": "ref.color.amber.100",
      "figma_variable": "ref/color/amber/100",
      "collection": "Vineyard Foundations",
      "type": "color"
    },
    {
      "token_path": "ref.color.amber.500",
      "figma_variable": "ref/color/amber/500",
      "collection": "Vineyard Foundations",
      "type": "color"
    },
    {
      "token_path": "ref.color.amber.700",
      "figma_variable": "ref/color/amber/700",
      "collection": "Vineyard Foundations",
      "type": "color"
    },
    {
      "token_path": "ref.color.water.100",
      "figma_variable": "ref/color/water/100",
      "collection": "Vineyard Foundations",
      "type": "color"
    },
    {
      "token_path": "ref.color.water.500",
      "figma_variable": "ref/color/water/500",
      "collection": "Vineyard Foundations",
      "type": "color"
    },
    {
      "token_path": "ref.color.water.700",
      "figma_variable": "ref/color/water/700",
      "collection": "Vineyard Foundations",
      "type": "color"
    },
    {
      "token_path": "ref.color.grape.100",
      "figma_variable": "ref/color/grape/100",
      "collection": "Vineyard Foundations",
      "type": "color"
    },
    {
      "token_path": "ref.color.grape.700",
      "figma_variable": "ref/color/grape/700",
      "collection": "Vineyard Foundations",
      "type": "color"
    },
    {
      "token_path": "ref.font.family.display",
      "figma_variable": "ref/font/family/display",
      "collection": "Vineyard Foundations",
      "type": "fontFamily"
    },
    {
      "token_path": "ref.font.family.ui",
      "figma_variable": "ref/font/family/ui",
      "collection": "Vineyard Foundations",
      "type": "fontFamily"
    },
    {
      "token_path": "ref.font.family.mono",
      "figma_variable": "ref/font/family/mono",
      "collection": "Vineyard Foundations",
      "type": "fontFamily"
    },
    {
      "token_path": "ref.font.size.100",
      "figma_variable": "ref/font/size/100",
      "collection": "Vineyard Foundations",
      "type": "dimension"
    },
    {
      "token_path": "ref.font.size.200",
      "figma_variable": "ref/font/size/200",
      "collection": "Vineyard Foundations",
      "type": "dimension"
    },
    {
      "token_path": "ref.font.size.300",
      "figma_variable": "ref/font/size/300",
      "collection": "Vineyard Foundations",
      "type": "dimension"
    },
    {
      "token_path": "ref.font.size.400",
      "figma_variable": "ref/font/size/400",
      "collection": "Vineyard Foundations",
      "type": "dimension"
    },
    {
      "token_path": "ref.font.size.500",
      "figma_variable": "ref/font/size/500",
      "collection": "Vineyard Foundations",
      "type": "dimension"
    },
    {
      "token_path": "ref.font.size.600",
      "figma_variable": "ref/font/size/600",
      "collection": "Vineyard Foundations",
      "type": "dimension"
    },
    {
      "token_path": "ref.font.size.700",
      "figma_variable": "ref/font/size/700",
      "collection": "Vineyard Foundations",
      "type": "dimension"
    },
    {
      "token_path": "ref.font.size.800",
      "figma_variable": "ref/font/size/800",
      "collection": "Vineyard Foundations",
      "type": "dimension"
    },
    {
      "token_path": "ref.font.size.900",
      "figma_variable": "ref/font/size/900",
      "collection": "Vineyard Foundations",
      "type": "dimension"
    },
    {
      "token_path": "ref.font.weight.regular",
      "figma_variable": "ref/font/weight/regular",
      "collection": "Vineyard Foundations",
      "type": "fontWeight"
    },
    {
      "token_path": "ref.font.weight.semibold",
      "figma_variable": "ref/font/weight/semibold",
      "collection": "Vineyard Foundations",
      "type": "fontWeight"
    },
    {
      "token_path": "ref.font.weight.bold",
      "figma_variable": "ref/font/weight/bold",
      "collection": "Vineyard Foundations",
      "type": "fontWeight"
    },
    {
      "token_path": "ref.space.0",
      "figma_variable": "ref/space/0",
      "collection": "Vineyard Foundations",
      "type": "dimension"
    },
    {
      "token_path": "ref.space.1",
      "figma_variable": "ref/space/1",
      "collection": "Vineyard Foundations",
      "type": "dimension"
    },
    {
      "token_path": "ref.space.2",
      "figma_variable": "ref/space/2",
      "collection": "Vineyard Foundations",
      "type": "dimension"
    },
    {
      "token_path": "ref.space.3",
      "figma_variable": "ref/space/3",
      "collection": "Vineyard Foundations",
      "type": "dimension"
    },
    {
      "token_path": "ref.space.4",
      "figma_variable": "ref/space/4",
      "collection": "Vineyard Foundations",
      "type": "dimension"
    },
    {
      "token_path": "ref.space.5",
      "figma_variable": "ref/space/5",
      "collection": "Vineyard Foundations",
      "type": "dimension"
    },
    {
      "token_path": "ref.space.6",
      "figma_variable": "ref/space/6",
      "collection": "Vineyard Foundations",
      "type": "dimension"
    },
    {
      "token_path": "ref.space.8",
      "figma_variable": "ref/space/8",
      "collection": "Vineyard Foundations",
      "type": "dimension"
    },
    {
      "token_path": "ref.space.10",
      "figma_variable": "ref/space/10",
      "collection": "Vineyard Foundations",
      "type": "dimension"
    },
    {
      "token_path": "ref.space.12",
      "figma_variable": "ref/space/12",
      "collection": "Vineyard Foundations",
      "type": "dimension"
    },
    {
      "token_path": "ref.space.16",
      "figma_variable": "ref/space/16",
      "collection": "Vineyard Foundations",
      "type": "dimension"
    },
    {
      "token_path": "ref.radius.sm",
      "figma_variable": "ref/radius/sm",
      "collection": "Vineyard Foundations",
      "type": "dimension"
    },
    {
      "token_path": "ref.radius.md",
      "figma_variable": "ref/radius/md",
      "collection": "Vineyard Foundations",
      "type": "dimension"
    },
    {
      "token_path": "ref.radius.lg",
      "figma_variable": "ref/radius/lg",
      "collection": "Vineyard Foundations",
      "type": "dimension"
    },
    {
      "token_path": "ref.radius.xl",
      "figma_variable": "ref/radius/xl",
      "collection": "Vineyard Foundations",
      "type": "dimension"
    },
    {
      "token_path": "ref.radius.round",
      "figma_variable": "ref/radius/round",
      "collection": "Vineyard Foundations",
      "type": "dimension"
    },
    {
      "token_path": "ref.motion.duration.quick",
      "figma_variable": "ref/motion/duration/quick",
      "collection": "Vineyard Foundations",